{
  "schema_version": "1.0",
  "slideId": "slide_02",
  "layoutId": "CONTEXT_01",
  "sectionLabel": "CONTEXT",
  "title": "Starting point and target state",
  "subtitle": "Why the current process is ready for controlled automation",
  "sourceChapterIds": ["1", "2"],
  "fieldProvenance": [
    { "path": "sectionLabel", "sourceChapterIds": ["1", "2"] },
    { "path": "title", "sourceChapterIds": ["1", "2"] },
    { "path": "subtitle", "sourceChapterIds": ["1", "2"] },
    { "path": "problem.title", "sourceChapterIds": ["2"] },
    { "path": "problem.description", "sourceChapterIds": ["2"] },
    { "path": "solution.title", "sourceChapterIds": ["1"] },
    { "path": "solution.description", "sourceChapterIds": ["1"] },
    { "path": "currentState.title", "sourceChapterIds": ["2"] },
    { "path": "currentState.description", "sourceChapterIds": ["2"] },
    { "path": "targetState.title", "sourceChapterIds": ["1"] },
    { "path": "targetState.description", "sourceChapterIds": ["1"] }
  ],
  "problem": {
    "title": "Problem",
    "description": "High-volume manual matching creates month-end bottlenecks and avoidable errors."
  },
  "solution": {
    "title": "Solution",
    "description": "A deterministic 3-way match handles clean invoices and explains every exception."
  },
  "currentState": {
    "title": "Current state",
    "description": "AP staff compare invoice, purchase-order and goods-receipt data line by line."
  },
  "targetState": {
    "title": "Target state",
    "description": "Clean matches flow automatically while exceptions and approval cases remain human-controlled."
  }
}
